{
  "envPath": "",
  "input": ".",
  "recursive": true,
  "output": ".",
  "runTests": {
    "recursive": true,
    "input": ".",
    "output": "./testResults.json",
    "setup": "",
    "cleanup": "",
    "mediaDirectory": ".",
    "downloadDirectory": ".",
    "contexts": [
      {
        "app": {
          "name": "firefox",
          "path": ""
        },
        "platforms": ["linux", "mac", "windows"]
      }
    ]
  },
  "runCoverage": {
    "recursive": true,
    "input": ".",
    "output": "./coverageReport.json",
    "markup": [
      "onscreenText",
      "emphasis",
      "image",
      "hyperlink",
      "orderedList",
      "unorderedList",
      "codeInline",
      "clodeBlock",
      "interaction"
    ]
  },
  "suggestTests": {
    "recursive": true,
    "input": ".",
    "output": "./testSuggestions.json",
    "markup": [
      "onscreenText",
      "emphasis",
      "image",
      "hyperlink",
      "orderedList",
      "unorderedList",
      "codeInline",
      "clodeBlock",
      "interaction"
    ]
  },
  "fileTypes": [
    {
      "extensions": [".md", ".mdx"],
      "testStartStatementOpen": "[comment]: # (test start",
      "testStartStatementClose": ")",
      "testIgnoreStatement": "[comment]: # (test ignore)",
      "testEndStatement": "[comment]: # (test end)",
      "actionStatementOpen": "[comment]: # (action",
      "actionStatementClose": ")",
      "markup": [
        {
          "name": "onscreenText",
          "regex": ["\\*\\*.+?\\*\\*"]
        },
        {
          "name": "emphasis",
          "regex": ["(?<!\\*)\\*(?!\\*).+?(?<!\\*)\\*(?!\\*)"]
        },
        {
          "name": "image",
          "regex": ["!\\[.+?\\]\\(.+?\\)"]
        },
        {
          "name": "hyperlink",
          "regex": ["(?<!!)\\[.+?\\]\\(.+?\\)"]
        },
        {
          "name": "orderedList",
          "regex": ["(?<=\n) *?[0-9][0-9]?[0-9]?.\\s*.*"]
        },
        {
          "name": "unorderedList",
          "regex": ["(?<=\n) *?\\*.\\s*.*", "(?<=\n) *?-.\\s*.*"]
        },
        {
          "name": "codeInline",
          "regex": ["(?<!`)`(?!`).+?(?<!`)`(?!`)"]
        },
        {
          "name": "codeBlock",
          "regex": ["(?=(```))(\\w|\\W)*(?<=```)"]
        },
        {
          "name": "interaction",
          "regex": [
            "[cC]lick",
            "[tT]ap",
            "[tT]ouch",
            "[sS]elect",
            "[cC]hoose",
            "[tT]oggle",
            "[eE]nable",
            "[dD]isable",
            "[tT]urn [oO][ff|n]",
            "[tT]ype",
            "[eE]nter"
          ]
        }
      ]
    }
  ],
  "integrations": {
    "openAi": {
      "apiKey": ""
    }
  },
  "telemetry": {
    "send": false,
    "userId": "",
    "detailLevel": "action-detailed",
    "customServers": []
  },
  "logLevel": "info"
}
